{
  "$schema": "http://json-schema.org/draft-07/schema#",
  "title": "CDiscourse Cloud Run Secret Manager manifest",
  "type": "object",
  "additionalProperties": false,
  "required": [
    "version",
    "environment",
    "project",
    "region",
    "runtimeServiceAccount",
    "replicationPolicy",
    "versionBindingPolicy",
    "labels",
    "secrets"
  ],
  "properties": {
    "$schema": { "type": "string" },
    "version": { "type": "integer", "const": 1 },
    "environment": { "type": "string", "enum": ["dev", "prod"] },
    "project": { "type": "string", "pattern": "^cdiscourse-host$" },
    "region": { "type": "string", "pattern": "^us-central1$" },
    "runtimeServiceAccount": {
      "type": "string",
      "pattern": "^cdiscourse-(dev|prod)-runner@cdiscourse-host\\.iam\\.gserviceaccount\\.com$"
    },
    "replicationPolicy": { "type": "string", "enum": ["automatic"] },
    "versionBindingPolicy": { "type": "string", "enum": ["latest"] },
    "labels": {
      "type": "object",
      "required": ["env"],
      "additionalProperties": { "type": "string" },
      "properties": {
        "env": { "type": "string", "enum": ["dev", "prod"] }
      }
    },
    "secrets": {
      "type": "array",
      "minItems": 1,
      "items": {
        "type": "object",
        "additionalProperties": false,
        "required": ["name", "cloudRunEnvVar", "purpose", "consumerFile"],
        "properties": {
          "name": {
            "type": "string",
            "pattern": "^cdiscourse-(dev|prod)-[a-z0-9-]+$",
            "minLength": 18,
            "maxLength": 63
          },
          "cloudRunEnvVar": {
            "type": "string",
            "pattern": "^EXPO_PUBLIC_[A-Z0-9_]+$"
          },
          "purpose": { "type": "string", "minLength": 8 },
          "consumerFile": { "type": "string", "pattern": "^src/" },
          "consumerSymbol": { "type": "string" }
        }
      }
    }
  }
}
