{
  "$schema": "./manifest.schema.json",
  "version": 1,
  "environment": "dev",
  "project": "cdiscourse-host",
  "region": "us-central1",
  "runtimeServiceAccount": "cdiscourse-dev-runner@cdiscourse-host.iam.gserviceaccount.com",
  "replicationPolicy": "automatic",
  "versionBindingPolicy": "latest",
  "labels": { "env": "dev", "card": "host-005" },
  "secrets": [
    {
      "name": "cdiscourse-dev-supabase-url",
      "cloudRunEnvVar": "EXPO_PUBLIC_SUPABASE_URL",
      "purpose": "Dev Supabase project REST URL. Routed through Secret Manager for parity with prod; not technically secret.",
      "consumerFile": "src/lib/supabase.ts",
      "consumerSymbol": "supabaseUrl"
    },
    {
      "name": "cdiscourse-dev-supabase-publishable-key",
      "cloudRunEnvVar": "EXPO_PUBLIC_SUPABASE_PUBLISHABLE_KEY",
      "purpose": "Dev Supabase publishable / anon key. Safe by Supabase design; routed through Secret Manager for parity with prod.",
      "consumerFile": "src/lib/supabase.ts",
      "consumerSymbol": "supabaseAnonKey"
    }
  ]
}
